Extracted contents:
header:          00 ff ff ff ff ff ff 00
serial number:   06 10 12 a0 00 00 00 00 1c 16
version:         01 04
basic params:    b5 30 1b 78 22
chroma info:     6f b1 a7 55 4c 9e 25 0c 50 54
established:     00 00 00
standard:        01 01 01 01 01 01 01 01 01 01 01 01 01 01 01 01
descriptor 1:    2e 36 80 a0 70 38 1f 40 30 20 35 00 59 c2 10 00 00 19
descriptor 2:    00 00 00 fc 00 69 4d 61 63 0a 20 20 20 20 20 20 20 20
descriptor 3:    00 00 00 fe 00 4c 47 20 44 69 73 70 6c 61 79 0a 20 20
descriptor 4:    00 00 00 fe 00 4c 50 31 35 36 57 46 34 2d 53 50 4c 31
extensions:      00
checksum:        89

Manufacturer: APP Model a012 Serial Number 0
Made week 28 of 2012
EDID version: 1.4
Digital display
10 bits per primary color channel
DisplayPort interface
Maximum image size: 48 cm x 27 cm
Gamma: 2.20
DPMS levels: Off
Supported color formats: RGB 4:4:4
First detailed timing is preferred timing
Chroma Info:
Red X: 0.653320 Y: 0.333984
Green X: 0.299805 Y: 0.620117
Blue X: 0.146484 Y: 0.049805
White X: 0.312500 Y: 0.329102
Established timings supported:
Standard timings supported:
Detailed mode: Clock 138.700 MHz, 345 mm x 194 mm
               1920 1968 2000 2080 hborder 0
               1080 1083 1088 1111 vborder 0
               -hsync -vsync 
Monitor name: iMac
ASCII string: LG
ASCII string: LP156WF4
Checksum: 0x89 (valid)
EDID block does NOT conform to EDID 1.3!
	Missing monitor ranges
	Detailed block string not properly terminated
